{
 "stops": [
  {
   "id": "breclav-1-maje",
   "name": "Břeclav, 1. máje",
   "lat": 48.758461,
   "lon": 16.878682,
   "zone": "575",
   "sourceId": "U15728N1965"
  },
  {
   "id": "breclav-autobusove-nadrazi",
   "name": "Břeclav, autobusové nádraží",
   "lat": 48.754552,
   "lon": 16.893289,
   "zone": "575",
   "sourceId": "U15729N402"
  },
  {
   "id": "breclav-autobusove-nadrazi",
   "name": "Břeclav, autobusové nádraží",
   "lat": 48.754552,
   "lon": 16.893289,
   "zone": "575",
   "sourceId": "U15729N402"
  },
  {
   "id": "breclav-bors",
   "name": "Břeclav, BORS",
   "lat": 48.75025,
   "lon": 16.893111,
   "zone": "575",
   "sourceId": "U15730N1984"
  },
  {
   "id": "breclav-bors",
   "name": "Břeclav, BORS",
   "lat": 48.75025,
   "lon": 16.893111,
   "zone": "575",
   "sourceId": "U15730N1984"
  },
  {
   "id": "breclav-cukrovar",
   "name": "Břeclav, cukrovar",
   "lat": 48.763461,
   "lon": 16.885673,
   "zone": "575",
   "sourceId": "U15731N1981"
  },
  {
   "id": "breclav-cukrovar",
   "name": "Břeclav, cukrovar",
   "lat": 48.763461,
   "lon": 16.885673,
   "zone": "575",
   "sourceId": "U15731N1981"
  },
  {
   "id": "breclav-dum-kultury",
   "name": "Břeclav, Dům kultury",
   "lat": 48.7571,
   "lon": 16.884827,
   "zone": "575",
   "sourceId": "U15757N2081"
  },
  {
   "id": "breclav-gumotex",
   "name": "Břeclav, Gumotex",
   "lat": 48.751366,
   "lon": 16.894592,
   "zone": "575",
   "sourceId": "U15732N1990"
  },
  {
   "id": "breclav-gumotex",
   "name": "Břeclav, Gumotex",
   "lat": 48.751366,
   "lon": 16.894592,
   "zone": "575",
   "sourceId": "U15732N1990"
  },
  {
   "id": "breclav-charvatska-n-ves-obrancu-miru",
   "name": "Břeclav, Charvátská N. Ves, Obránců míru",
   "lat": 48.769287,
   "lon": 16.84762,
   "zone": "575",
   "sourceId": "U15754N2083"
  },
  {
   "id": "breclav-charvatska-nova-ves-lednicka",
   "name": "Břeclav, Charvátská Nová Ves, Lednická",
   "lat": 48.766752,
   "lon": 16.846556,
   "zone": "575",
   "sourceId": "U15733N1960"
  },
  {
   "id": "breclav-charvatska-nova-ves-palackeho",
   "name": "Břeclav, Charvátská Nová Ves, Palackého",
   "lat": 48.762334,
   "lon": 16.851012,
   "zone": "575",
   "sourceId": "U15753N2082"
  },
  {
   "id": "breclav-jana-palacha",
   "name": "Břeclav, Jana Palacha",
   "lat": 48.756161,
   "lon": 16.888901,
   "zone": "575",
   "sourceId": "U15751N2075"
  },
  {
   "id": "breclav-lanzhotska",
   "name": "Břeclav, Lanžhotská",
   "lat": 48.750778,
   "lon": 16.903667,
   "zone": "575",
   "sourceId": "U15756N2084"
  },
  {
   "id": "breclav-mestsky-hrbitov",
   "name": "Břeclav, Městský hřbitov",
   "lat": 48.750368,
   "lon": 16.906646,
   "zone": "575",
   "sourceId": "U15755N2074"
  },
  {
   "id": "breclav-namesti-tgm-kostel",
   "name": "Břeclav, náměstí TGM, kostel",
   "lat": 48.759272,
   "lon": 16.88078,
   "zone": "575",
   "sourceId": "U15736N1964"
  },
  {
   "id": "breclav-namesti-tgm-kostel",
   "name": "Břeclav, náměstí TGM, kostel",
   "lat": 48.759272,
   "lon": 16.88078,
   "zone": "575",
   "sourceId": "U15736N1964"
  },
  {
   "id": "breclav-namesti-tgm-mestsky-urad",
   "name": "Břeclav, náměstí TGM, městský úřad",
   "lat": 48.759683,
   "lon": 16.881319,
   "zone": "575",
   "sourceId": "U15737N1982"
  },
  {
   "id": "breclav-namesti-tgm-mestsky-urad",
   "name": "Břeclav, náměstí TGM, městský úřad",
   "lat": 48.759683,
   "lon": 16.881319,
   "zone": "575",
   "sourceId": "U15737N1982"
  },
  {
   "id": "breclav-nemocnice",
   "name": "Břeclav, nemocnice",
   "lat": 48.753134,
   "lon": 16.881758,
   "zone": "575",
   "sourceId": "U15738N2088"
  },
  {
   "id": "breclav-pohansko-rozcesti",
   "name": "Břeclav, Pohansko, rozcestí",
   "lat": 48.749451,
   "lon": 16.900769,
   "zone": "575",
   "sourceId": "U15739N1985"
  },
  {
   "id": "breclav-pohansko-rozcesti",
   "name": "Břeclav, Pohansko, rozcestí",
   "lat": 48.749451,
   "lon": 16.900769,
   "zone": "575",
   "sourceId": "U15739N1985"
  },
  {
   "id": "breclav-poliklinika",
   "name": "Břeclav, poliklinika",
   "lat": 48.752843,
   "lon": 16.883794,
   "zone": "575",
   "sourceId": "U15740N1983"
  },
  {
   "id": "breclav-poliklinika",
   "name": "Břeclav, poliklinika",
   "lat": 48.752843,
   "lon": 16.883794,
   "zone": "575",
   "sourceId": "U15740N1983"
  },
  {
   "id": "breclav-postorna-fosfa",
   "name": "Břeclav, Poštorná, FOSFA",
   "lat": 48.741131,
   "lon": 16.870569,
   "zone": "575",
   "sourceId": "U15764N2087"
  },
  {
   "id": "breclav-postorna-hlavni",
   "name": "Břeclav, Poštorná, Hlavní",
   "lat": 48.755394,
   "lon": 16.863281,
   "zone": "575",
   "sourceId": "U15752N2080"
  },
  {
   "id": "breclav-postorna-hlavni-na-konci",
   "name": "Břeclav, Poštorná, Hlavní na konci",
   "lat": 48.7586,
   "lon": 16.859367,
   "zone": "575",
   "sourceId": "U15741N1961"
  },
  {
   "id": "breclav-postorna-hranicni",
   "name": "Břeclav, Poštorná, Hraniční",
   "lat": 48.746436,
   "lon": 16.870765,
   "zone": "575",
   "sourceId": "U15763N2086"
  },
  {
   "id": "breclav-postorna-j-skacela-1-maje",
   "name": "Břeclav, Poštorná, J. Skácela / 1. máje",
   "lat": 48.753123,
   "lon": 16.869078
  },
  {
   "id": "breclav-postorna-jana-skacela",
   "name": "Břeclav, Poštorná, Jana Skácela",
   "lat": 48.749848,
   "lon": 16.869392,
   "zone": "575",
   "sourceId": "U15762N2085"
  },
  {
   "id": "breclav-postorna-kostel",
   "name": "Břeclav, Poštorná, kostel",
   "lat": 48.752909,
   "lon": 16.867413,
   "zone": "575",
   "sourceId": "U15742N1962"
  },
  {
   "id": "breclav-postorna-kostel",
   "name": "Břeclav, Poštorná, kostel",
   "lat": 48.752909,
   "lon": 16.867413,
   "zone": "575",
   "sourceId": "U15742N1962"
  },
  {
   "id": "breclav-postorna-lesni",
   "name": "Břeclav, Poštorná, Lesní",
   "lat": 48.755743,
   "lon": 16.873957,
   "zone": "575",
   "sourceId": "U15743N1963"
  },
  {
   "id": "breclav-postorna-lesni",
   "name": "Břeclav, Poštorná, Lesní",
   "lat": 48.755743,
   "lon": 16.873957,
   "zone": "575",
   "sourceId": "U15743N1963"
  },
  {
   "id": "breclav-postorna-nadrazni",
   "name": "Břeclav, Poštorná, Nádražní",
   "lat": 48.752103,
   "lon": 16.858368,
   "zone": "575",
   "sourceId": "U15758N2076"
  },
  {
   "id": "breclav-postorna-pkz",
   "name": "Břeclav, Poštorná, PKZ",
   "lat": 48.751964,
   "lon": 16.85204,
   "zone": "575",
   "sourceId": "U15744N2077"
  },
  {
   "id": "breclav-postorna-pkz",
   "name": "Břeclav, Poštorná, PKZ",
   "lat": 48.751964,
   "lon": 16.85204,
   "zone": "575",
   "sourceId": "U15744N2077"
  },
  {
   "id": "breclav-postorna-tovarni-ctvrt",
   "name": "Břeclav, Poštorná, Tovární čtvrť",
   "lat": 48.754713,
   "lon": 16.849599,
   "zone": "575",
   "sourceId": "U15759N2078"
  },
  {
   "id": "breclav-postorna-valticka",
   "name": "Břeclav, Poštorná, Valtická",
   "lat": 48.756558,
   "lon": 16.856743,
   "zone": "575",
   "sourceId": "U15745N2033"
  },
  {
   "id": "breclav-postorna-valticka",
   "name": "Břeclav, Poštorná, Valtická",
   "lat": 48.756558,
   "lon": 16.856743,
   "zone": "575",
   "sourceId": "U15745N2033"
  },
  {
   "id": "breclav-postorna-valticka-tocna",
   "name": "Břeclav, Poštorná, Valtická, točna",
   "lat": 48.758005,
   "lon": 16.849742,
   "zone": "575",
   "sourceId": "U15760N2079"
  },
  {
   "id": "breclav-slovacka",
   "name": "Břeclav, Slovácká",
   "lat": 48.759645,
   "lon": 16.887459,
   "zone": "575",
   "sourceId": "U15770N2096"
  },
  {
   "id": "breclav-sovadinova",
   "name": "Břeclav, Sovadinova",
   "lat": 48.763067,
   "lon": 16.88926,
   "zone": "575",
   "sourceId": "U15771N2097"
  },
  {
   "id": "breclav-stara-breclav-j-molaka",
   "name": "Břeclav, Stará Břeclav, J. Moláka",
   "lat": 48.777407,
   "lon": 16.897259,
   "zone": "575",
   "sourceId": "U15734N2092"
  },
  {
   "id": "breclav-stara-breclav-krizovatka-ladna",
   "name": "Břeclav, Stará Břeclav, křižovatka Ladná",
   "lat": 48.779601,
   "lon": 16.902587,
   "zone": "575",
   "sourceId": "U15735N1979"
  },
  {
   "id": "breclav-stara-breclav-krizovatka-ladna",
   "name": "Břeclav, Stará Břeclav, křižovatka Ladná",
   "lat": 48.779601,
   "lon": 16.902587,
   "zone": "575",
   "sourceId": "U15735N1979"
  },
  {
   "id": "breclav-stara-breclav-kulturni-dum",
   "name": "Břeclav, Stará Břeclav, kulturní dům",
   "lat": 48.774218,
   "lon": 16.886674,
   "zone": "575",
   "sourceId": "U15747N2090"
  },
  {
   "id": "breclav-stara-breclav-lidicka",
   "name": "Břeclav, Stará Břeclav, Lidická",
   "lat": 48.76778,
   "lon": 16.890053,
   "zone": "575",
   "sourceId": "U15769N2094"
  },
  {
   "id": "breclav-stara-breclav-manesova",
   "name": "Břeclav, Stará Břeclav, Mánesova",
   "lat": 48.772417,
   "lon": 16.887833,
   "zone": "575",
   "sourceId": "U15772N2098"
  },
  {
   "id": "breclav-stara-breclav-manesova-2",
   "name": "Břeclav, Stará Břeclav, Mánesova",
   "lat": 48.772506,
   "lon": 16.887847
  },
  {
   "id": "breclav-stara-breclav-skopalikova",
   "name": "Břeclav, Stará Břeclav, Skopalíkova",
   "lat": 48.772893,
   "lon": 16.891364,
   "zone": "575",
   "sourceId": "U15746N1980"
  },
  {
   "id": "breclav-stara-breclav-skopalikova",
   "name": "Břeclav, Stará Břeclav, Skopalíkova",
   "lat": 48.772893,
   "lon": 16.891364,
   "zone": "575",
   "sourceId": "U15746N1980"
  },
  {
   "id": "breclav-stara-breclav-u-parku",
   "name": "Břeclav, Stará Břeclav, u parku",
   "lat": 48.775273,
   "lon": 16.890122,
   "zone": "575",
   "sourceId": "U15767N2091"
  },
  {
   "id": "breclav-stara-breclav-vinohradni",
   "name": "Břeclav, Stará Břeclav, Vinohradní",
   "lat": 48.77552,
   "lon": 16.89359,
   "zone": "575",
   "sourceId": "U15768N2093"
  },
  {
   "id": "ladna-mlynska",
   "name": "Ladná, Mlýnská",
   "lat": 48.80821,
   "lon": 16.884937,
   "zone": "565",
   "sourceId": "U15606N2034"
  },
  {
   "id": "ladna-skola",
   "name": "Ladná, škola",
   "lat": 48.805472,
   "lon": 16.872155,
   "zone": "565",
   "sourceId": "U15608N2035"
  },